A1: 39210 | B1: Chavers | C1: RFID: Privacy vs. Security
B2: Atwood | C2: RFID Biometric Data
B3: Riggs | C3: Mass Identification and Authorization Processes vs. Privacy and Anonymity
B4: Bailey | C4: Hard Disk Encryption
A5: =+A1+2 -> 39212 | B5: Heinritz | C5: Fingerprint Identification
B6: Mertz | C6: Biometrics Overview
B7: Kaemmer | C7: Biometric Identification Cards
B8: Cvetan | C8: Biometric Identification: Retina and Iris Methods
A9: =+A5+1 -> 39213 | B9: Winkler | C9: Windows Vista Security
B10: Footit | C10: Windows Vista User Account Control (UAC)
B11: Beetcher | C11: Key Logging in Windows XP
B12: Mischock | C12: DVD Encryption
A13: =+A1+7 -> 39217 | B13: Geboy | C13: Java Cryptography Architecture
B14: Hammel | C14: Elliptic Curve Cryptography
B15: Phillips | C15: Rainbow Tables
A16: =+A5+7 -> 39219 | B16: Handl | C16: Online Banking Authentication
B17: Marg | C17: Honey Pots
B18: Skibinski | C18: VLANs
A19: =+A9+7 -> 39220 | B19: Patterson | C19: Insiders Who Threaten Security
B20: Heck | C20: File system security
B21: Musick | C21: Security in Cellular Phones